{
  "schema_version": "2.0.0",
  "metadata": {
    "generated_at": "2026-10-13T18:51:52.196194+00:00",
    "as_of": "2026-10-13T18:51:52.196194+00:00",
    "measurement_period_start": "2026-09-01T05:11:04+00:00",
    "measurement_period_end": "2026-09-30T23:50:01+00:00",
    "is_demonstration_mode": true,
    "disclaimer": "DEMONSTRATION NOTICE: Figures in this report are generated from synthetic test records and simulated models for accountability demonstration purposes only. They do NOT reflect genuine platform performance or real law enforcement investigations.",
    "k_anonymity_threshold": 10,
    "total_requests_analyzed": 250
  },
  "overall_performance": {
    "total_takedown_requests": 190,
    "eligible_takedown_requests": 179,
    "mature_takedown_requests": 179,
    "completed_takedowns": 141,
    "rejections_count": 10,
    "rejection_rate_pct": 5.59,
    "median_removal_hours": 18.93,
    "median_removal_censored": false,
    "median_removal_display": "18.9h",
    "p90_removal_hours": null,
    "p90_removal_censored": true,
    "p90_removal_display": "> measurement window",
    "deadline_compliance_rate_pct": 21.89,
    "still_available_rate_pct": 16.57,
    "total_data_requests": 60,
    "mature_data_requests": 55,
    "completed_data_requests": 49,
    "median_data_response_hours": 49.94,
    "p90_data_response_hours": 95.58,
    "data_deadline_compliance_rate_pct": 69.09,
    "incomplete_police_requests_count": 16,
    "invalid_records_count": 0,
    "false_removal_claims_count": 7,
    "observed_reuploads_count": 0,
    "verified_takedowns_count": 138
  },
  "platform_breakdown": [
    {
      "platform": "Platform A",
      "is_suppressed": false,
      "sample_size": 22,
      "median_removal_hours": 9.06,
      "median_removal_censored": false,
      "median_removal_display": "9.1h",
      "p90_removal_hours": 19.84,
      "p90_removal_censored": false,
      "p90_removal_display": "19.8h",
      "deadline_compliance_rate_pct": 41.18,
      "still_available_rate_pct": 5.88,
      "rejections_count": 0,
      "rejection_rate_pct": 0.0,
      "median_data_response_hours": null,
      "incomplete_requests_count": 0,
      "suppression_reason": null,
      "false_removal_claims_count": 1,
      "observed_reuploads_count": 0,
      "verified_takedowns_count": 15
    },
    {
      "platform": "Platform B",
      "is_suppressed": false,
      "sample_size": 20,
      "median_removal_hours": 11.18,
      "median_removal_censored": false,
      "median_removal_display": "11.2h",
      "p90_removal_hours": null,
      "p90_removal_censored": true,
      "p90_removal_display": "> measurement window",
      "deadline_compliance_rate_pct": 45.45,
      "still_available_rate_pct": 18.18,
      "rejections_count": null,
      "rejection_rate_pct": null,
      "median_data_response_hours": null,
      "incomplete_requests_count": null,
      "suppression_reason": null,
      "false_removal_claims_count": 1,
      "observed_reuploads_count": 0,
      "verified_takedowns_count": 9
    },
    {
      "platform": "Platform C",
      "is_suppressed": false,
      "sample_size": 27,
      "median_removal_hours": 12.58,
      "median_removal_censored": false,
      "median_removal_display": "12.6h",
      "p90_removal_hours": 36.63,
      "p90_removal_censored": false,
      "p90_removal_display": "36.6h",
      "deadline_compliance_rate_pct": 25.0,
      "still_available_rate_pct": 6.25,
      "rejections_count": 0,
      "rejection_rate_pct": 0.0,
      "median_data_response_hours": null,
      "incomplete_requests_count": null,
      "suppression_reason": null,
      "false_removal_claims_count": 0,
      "observed_reuploads_count": 0,
      "verified_takedowns_count": 15
    },
    {
      "platform": "Platform D",
      "is_suppressed": false,
      "sample_size": 25,
      "median_removal_hours": 16.65,
      "median_removal_censored": false,
      "median_removal_display": "16.6h",
      "p90_removal_hours": null,
      "p90_removal_censored": true,
      "p90_removal_display": "> measurement window",
      "deadline_compliance_rate_pct": 17.65,
      "still_available_rate_pct": 11.76,
      "rejections_count": null,
      "rejection_rate_pct": null,
      "median_data_response_hours": null,
      "incomplete_requests_count": null,
      "suppression_reason": null,
      "false_removal_claims_count": 1,
      "observed_reuploads_count": 0,
      "verified_takedowns_count": 15
    },
    {
      "platform": "Platform E",
      "is_suppressed": false,
      "sample_size": 25,
      "median_removal_hours": 12.62,
      "median_removal_censored": false,
      "median_removal_display": "12.6h",
      "p90_removal_hours": null,
      "p90_removal_censored": true,
      "p90_removal_display": "> measurement window",
      "deadline_compliance_rate_pct": 20.0,
      "still_available_rate_pct": 13.33,
      "rejections_count": null,
      "rejection_rate_pct": null,
      "median_data_response_hours": null,
      "incomplete_requests_count": null,
      "suppression_reason": null,
      "false_removal_claims_count": 1,
      "observed_reuploads_count": 0,
      "verified_takedowns_count": 13
    },
    {
      "platform": "Platform F",
      "is_suppressed": false,
      "sample_size": 23,
      "median_removal_hours": 23.54,
      "median_removal_censored": false,
      "median_removal_display": "23.5h",
      "p90_removal_hours": null,
      "p90_removal_censored": true,
      "p90_removal_display": "> measurement window",
      "deadline_compliance_rate_pct": 7.14,
      "still_available_rate_pct": 21.43,
      "rejections_count": null,
      "rejection_rate_pct": null,
      "median_data_response_hours": null,
      "incomplete_requests_count": null,
      "suppression_reason": null,
      "false_removal_claims_count": 1,
      "observed_reuploads_count": 0,
      "verified_takedowns_count": 11
    },
    {
      "platform": "Platform G",
      "is_suppressed": false,
      "sample_size": 32,
      "median_removal_hours": 32.0,
      "median_removal_censored": false,
      "median_removal_display": "32.0h",
      "p90_removal_hours": null,
      "p90_removal_censored": true,
      "p90_removal_display": "> measurement window",
      "deadline_compliance_rate_pct": 13.04,
      "still_available_rate_pct": 34.78,
      "rejections_count": 0,
      "rejection_rate_pct": 0.0,
      "median_data_response_hours": null,
      "incomplete_requests_count": null,
      "suppression_reason": null,
      "false_removal_claims_count": 1,
      "observed_reuploads_count": 0,
      "verified_takedowns_count": 15
    },
    {
      "platform": "Platform H",
      "is_suppressed": false,
      "sample_size": 27,
      "median_removal_hours": 24.72,
      "median_removal_censored": false,
      "median_removal_display": "24.7h",
      "p90_removal_hours": null,
      "p90_removal_censored": true,
      "p90_removal_display": "> measurement window",
      "deadline_compliance_rate_pct": 15.79,
      "still_available_rate_pct": 36.84,
      "rejections_count": null,
      "rejection_rate_pct": null,
      "median_data_response_hours": null,
      "incomplete_requests_count": 0,
      "suppression_reason": null,
      "false_removal_claims_count": 0,
      "observed_reuploads_count": 0,
      "verified_takedowns_count": 12
    },
    {
      "platform": "Platform I",
      "is_suppressed": false,
      "sample_size": 17,
      "median_removal_hours": 23.29,
      "median_removal_censored": false,
      "median_removal_display": "23.3h",
      "p90_removal_hours": 33.43,
      "p90_removal_censored": false,
      "p90_removal_display": "33.4h",
      "deadline_compliance_rate_pct": 0.0,
      "still_available_rate_pct": 9.09,
      "rejections_count": 0,
      "rejection_rate_pct": 0.0,
      "median_data_response_hours": null,
      "incomplete_requests_count": null,
      "suppression_reason": null,
      "false_removal_claims_count": 1,
      "observed_reuploads_count": 0,
      "verified_takedowns_count": 10
    },
    {
      "platform": "Platform J",
      "is_suppressed": false,
      "sample_size": 32,
      "median_removal_hours": 21.49,
      "median_removal_censored": false,
      "median_removal_display": "21.5h",
      "p90_removal_hours": 60.06,
      "p90_removal_censored": false,
      "p90_removal_display": "60.1h",
      "deadline_compliance_rate_pct": 30.77,
      "still_available_rate_pct": 3.85,
      "rejections_count": null,
      "rejection_rate_pct": null,
      "median_data_response_hours": null,
      "incomplete_requests_count": null,
      "suppression_reason": null,
      "false_removal_claims_count": 0,
      "observed_reuploads_count": 0,
      "verified_takedowns_count": 23
    }
  ],
  "category_breakdown": [
    {
      "category": "CSAM",
      "is_suppressed": false,
      "sample_size": 71,
      "median_removal_hours": 18.17,
      "median_removal_censored": false,
      "median_removal_display": "18.2h",
      "p90_removal_hours": null,
      "p90_removal_censored": true,
      "p90_removal_display": "> measurement window",
      "deadline_compliance_rate_pct": 21.28,
      "suppression_reason": null
    },
    {
      "category": "FinancialFraud",
      "is_suppressed": false,
      "sample_size": 57,
      "median_removal_hours": 23.59,
      "median_removal_censored": false,
      "median_removal_display": "23.6h",
      "p90_removal_hours": null,
      "p90_removal_censored": true,
      "p90_removal_display": "> measurement window",
      "deadline_compliance_rate_pct": 23.81,
      "suppression_reason": null
    },
    {
      "category": "Impersonation",
      "is_suppressed": false,
      "sample_size": 64,
      "median_removal_hours": 20.67,
      "median_removal_censored": false,
      "median_removal_display": "20.7h",
      "p90_removal_hours": 87.15,
      "p90_removal_censored": false,
      "p90_removal_display": "87.2h",
      "deadline_compliance_rate_pct": 31.43,